metric_id,name,machine_code,data_type,field_name,description,small,medium,large,method,metric_group_id,is_active,docs_url
1,Primary Channel Gradient,STRMGRAD,REAL,RME_IGO_prim_channel_gradient,Change in elevation along Flowline length,200.0,400.0,1400.0,(ğ‘¡ğ‘œğ‘ ğ‘œğ‘“ ğ‘Ÿğ‘’ğ‘ğ‘â„ ğ‘’ğ‘™ğ‘’ğ‘£ğ‘ğ‘¡ğ‘–ğ‘œğ‘› âˆ’ğ‘ğ‘œğ‘¡ğ‘¡ğ‘œğ‘š ğ‘œğ‘“ ğ‘Ÿğ‘’ğ‘ğ‘â„ ğ‘’ğ‘™ğ‘’ğ‘£ğ‘ğ‘¡ğ‘–ğ‘œğ‘›)/(ğ‘›ğ‘’ğ‘¡ğ‘¤ğ‘œğ‘Ÿğ‘˜ ğ‘™ğ‘’ğ‘›ğ‘”ğ‘¡â„),1,1,"Hack, J. T. (1973). Stream-profile analysis and stream-gradient index. Journal of Research of the U.S. Geological Survey, 1(4), 421â€“429. Nagel, D., Buffington, J., & Isaak, D. (4006). Comparison of methods for estimating stream channel gradient using GIS. USDA Forest Service, Rocky Mountain Research Station Boise Aquatic Sciences Lab."
2,Valley Gradient,VALGRAD,REAL,RME_IGO_valleybottom_gradient,Change in elevation along Centerline length,200.0,400.0,1400.0,(ğ‘¡ğ‘œğ‘ ğ‘œğ‘“ ğ‘ ğ‘’ğ‘”ğ‘šğ‘’ğ‘›ğ‘¡ ğ‘’ğ‘™ğ‘’ğ‘£. âˆ’ğ‘ğ‘œğ‘¡ğ‘¡ğ‘œğ‘š ğ‘œğ‘“ ğ‘ ğ‘’ğ‘”ğ‘šğ‘’ğ‘›ğ‘¡ ğ‘’ğ‘™ğ‘’ğ‘£.)/(ğ‘£ğ‘ğ‘™ğ‘™ğ‘’ğ‘¦ ğ‘ğ‘œğ‘¡ğ‘¡ğ‘œğ‘š ğ‘ğ‘’ğ‘›ğ‘¡ğ‘’ğ‘Ÿğ‘™ğ‘–ğ‘›ğ‘’),1,1,
3,Stream Order,STRMORDR,INTEGER,NHD_DGO_streamorder,standard strahler order attribute from NHD,,,,Copy NHD Attribute,1,1,
4,Headwater,HEDWTR,INTEGER,NHD_DGO_headwater,Is greater than 50% of the analysis window marked as is_headwater?,400,400,400,Copy NHD VAA Attribute STARTFLAG,1,1,
5,Stream Type,STRMTYPE,INTEGER,NHD_DGO_streamtype,NHD F Code Attribute,200,400,1400,Copy NHD Attribute FCODE,1,1,
6,Low-Lying Valley Bottom,ACTFLDAREA,REAL,VBET_DGO_lowlying_area,Area of VBET Low Lying Floodplain,200,400,1400,Copy VBET Attribute,1,1,
7,Elevated Valley Bottom,INACTFLDAREA,REAL,VBET_DGO_elevated_area,Area of VBET Elevated Floodplain,200,400,1400,Copy VBET Attribute,1,1,
8,Active Channel Area,ACTCHANAREA,REAL,VBET_DGO_channel_area,Area of VBET Channel Area,200,400,1400,Copy VBET Attribute,1,1,
9,Floodplain Area,FLDPLNAREA,REAL,VBET_DGO_flodplain_area,Area of VBET Flood Plain,200,400,1400,Copy VBET Attribute,1,1,
10,Integrated Width,INTGWDTH,REAL,VBET_IGO_integrated_width,Integrated width of Tier 1 polygons,200,400,1400,Copy VBET Attribute,1,1,
11,Active Channel Ratio,CHANVBRAT,REAL,VBET_IGO_active_channel_ratio,Active Channel Area to Inactive + active floodplain polygons + Channel area polygon Ratio,200,400,1400,,1,1,
12,Low-Lying Ratio,LOWLYVBRAT,REAL,VBET_IGO_low_lying_ratio,Low Lying Floodplain Area to total valley bottom area Ratio,200,400,1400,,1,1,
13,Elevated Ratio,ELEVATEDVBRAT,REAL,VBET_IGO_elevated_ratio,Elevated Floodplain Area to total valley bottom area Ratio,200,400,1400,,1,1,
14,Floodplain Ratio,FLDVBRAT,REAL,VBET_IGO_floodplain_ratio,Floodplain Area to total valley bottom area Ratio,200,400,1400,,1,1,
15,Acres Valley Bottom Per Mile,ACRESVBPM,REAL,VBET_IGO_acres_vb_per_mile,Acres of Valley Bottom per mile of valley length,200,400,1400,,1,1,
16,Hectares Valley Bottom Per KM,HECTVBPKM,REAL,VBET_IGO_hect_vb_per_km,Hectares of Valley Bottom per km of valley length,200,400,1400,,1,1,
17,Relative Flow Length,RELFLWLNGTH,REAL,RME_IGO_rel_flow_length,,200,400,1400,sum of all blue line lenth/valley length,1,1,
18,Stream Size Metric,STRMSIZE,REAL,VBET_DGO_streamsize,Stream Size (calculated as integrated channel width),200,400,1400,,1,1,
19,Valley Azimuth,VALAZMTH,REAL,RME_IGO_valley_azimuth,,200,400,1400,,,,
20,Ecoregion III,ECORGIII,REAL,EPA_DGO_ecoregion3,"which ecoregion contains the majority of the analysis window?",500,500,1400,,2,1,
21,Confluence C1ount,CONF,INTEGER,RME_DGO_confluences,,200,400,1400,,2,1
22,Diffluence Count,DIFF,INTEGER,REM_DGO_diffluences,,200,400,1400,,2,1
23,Planform Sinuosity of Main LevelPath,CHANSIN,REAL,RME_IGO_planform_sinuosity,,200,400,1400,(ğ‘›ğ‘’ğ‘¡ğ‘¤ğ‘œğ‘Ÿğ‘˜ ğ‘™ğ‘’ğ‘›ğ‘”ğ‘¡â„)/(ğ‘ ğ‘¡ğ‘Ÿğ‘ğ‘–ğ‘”â„ğ‘¡âˆ’ğ‘™ğ‘–ğ‘›ğ‘’ ğ‘‘ğ‘–ğ‘ ğ‘¡ğ‘ğ‘›ğ‘ğ‘’),2,1,
24,Drainage Area,DRAINAREA,REAL,RME_DGO_drainage_area,,200,400,1400,,2,1,
25,Ecoregion IV,ECORGIV,TEXT,EPA_DGO_ecoregion4,which ecoregion contains the majority of the analysis window?,200,400,1400,,2,1,
26,Floodplain Count River Left,CNTFLDL,INTEGER,,,200,400,1400,,2,
27,Confinement,CNFMT,REAL,Conf_IGO_confinement_ratio,,200,400,1400,Copy Confinement Attribute,3,1,
28,Constriction,CONST,REAL,Conf_IGO_constriction_ratio,,200,400,1400,Copy Constriction Attribute,3,1,
29,Length of Confining Margins,CONFMARG,REAL,Conf_DGO_confining_margins,,200,400,1400,Copy Confining Margin Attribute,3,1,
30,Anthropogenic Confinement,ANTHCNFMT,REAL,,,,,,(ğ¶ğ‘œğ‘›ğ‘“ğ‘–ğ‘›ğ‘–ğ‘›ğ‘” ğ‘šğ‘ğ‘Ÿğ‘”ğ‘–ğ‘› ğ‘™ğ‘’ğ‘›ğ‘”ğ‘¡â„)/(ğ‘›ğ‘’ğ‘¡ğ‘¤ğ‘œğ‘Ÿğ‘˜ ğ‘™ğ‘’ğ‘›ğ‘”ğ‘¡â„) ğ‘¥ 200,3,
31,Grainsize,GRNSIZE,REAL,,,200,400,1400,,3,
32,Tributary Junction Count,TRIBS,INTEGER,RME_IGO_trib_per_km,,400,400,1400,,2,1,
33,Floodplain Count River Right,CNTFLDR,INTEGER,,,200,400,1400,,2,,
34,Road Density,ROADDENS,REAL,Anthro_IGO_road_dens,,200,400,1400,,3,1,
35,Rail Density,RAILDENS,REAL,Anthro_IGO_rail_dens,,200,400,1400,,3,1,
36,Land Use Intensity,LUI,REAL,Anthro_IGO_land_use_intens,,200,400,1400,,3,1,
37,Floodplain Accessibility,FPACCESS,REAL,RCAT_IGO_fldpln_access,,200,400,1400,,3,1,
38,Ownership,AGENCY,TEXT,rme_dgo_ownership,,200,400,1400,,3,1,
39,State,STATE,TEXT,rme_dgo_state,,200,400,1400,,3,1,
40,County,COUNTY,TEXT,rme_dgo_county,,200,400,1400,,3,1,