calculation_id,calculation_method,description
1,value from dgo,no moving window analysis - copy the value directly from another dgo as the metric
2,add value across window,the sum of the value for a given field for each dgo in a window
3,add and divide by centerline,sum the values for a given field across the window then divide by the total centerline length
4,add and divide by channel length,sum the values for a given field across the window then divide by the channel length
5,proportion,the proportion across a window
6,area weighted average,the area weighted average of a field across a window